{
    "$schema": "../schemas/alternative-methods.schema.json",
    "version": "0.15.4h",
    "description": "Alternative bypass methods configuration for obstacles when primary skills are unavailable",
    "alternatives": {
        "LockedDoor": [
            {
                "methodId": "alt_door_find_key",
                "methodName": "Find Key",
                "description": "Search nearby areas or negotiate with someone who has the key.",
                "requiredCheck": "Investigation",
                "checkDc": 14,
                "timeRequired": "10-30 minutes",
                "prerequisites": [],
                "consequences": [
                    "Time spent searching",
                    "May trigger random encounters",
                    "Social interaction may require favors or payment"
                ],
                "flavorText": {
                    "attempt": "You begin methodically searching the area for a key or someone who might have one.",
                    "success": "Your thorough search pays off—you find the key hidden nearby.",
                    "failure": "Despite your efforts, no key can be found in the immediate area."
                },
                "uiHints": {
                    "colorHint": "green",
                    "iconHint": "key"
                }
            },
            {
                "methodId": "alt_door_brute_force",
                "methodName": "Brute Force",
                "description": "Use raw strength to break down the door.",
                "requiredCheck": "Might",
                "checkDc": 12,
                "checkDcNote": "Varies by door type - see brute-force-options.json",
                "timeRequired": "1-3 rounds",
                "prerequisites": [],
                "consequences": [
                    "Loud noise alerts nearby",
                    "Contents behind door may be damaged",
                    "Multiple attempts cause exhaustion"
                ],
                "linksToBruteForce": true,
                "flavorText": {
                    "attempt": "You brace yourself and prepare to force your way through.",
                    "success": "The door gives way under your assault.",
                    "failure": "The door holds firm against your strength."
                },
                "uiHints": {
                    "colorHint": "red",
                    "iconHint": "fist"
                }
            },
            {
                "methodId": "alt_door_runic_bypass",
                "methodName": "Runic Bypass",
                "description": "Manipulate the lock's runic bindings to release the mechanism.",
                "requiredCheck": "Runecraft",
                "checkDc": 16,
                "timeRequired": "1 round",
                "prerequisites": [
                    "[Rune Sight] ability or equivalent",
                    "Runecraft skill trained"
                ],
                "consequences": [
                    "Essence cost (1-3 points)",
                    "Potential corruption exposure",
                    "May trigger runic alarms"
                ],
                "essenceCost": {
                    "min": 1,
                    "max": 3
                },
                "flavorText": {
                    "attempt": "You focus your Rune Sight on the lock, perceiving the binding patterns within.",
                    "success": "The runic bindings unravel at your touch—the lock clicks open silently.",
                    "failure": "The runic patterns resist your manipulation. The binding holds."
                },
                "uiHints": {
                    "colorHint": "purple",
                    "iconHint": "rune"
                }
            },
            {
                "methodId": "alt_door_alternate_route",
                "methodName": "Alternate Route",
                "description": "Find another path: ventilation shaft, window, or collapsed wall.",
                "requiredCheck": "Perception",
                "checkDc": 14,
                "timeRequired": "5-20 minutes",
                "prerequisites": [],
                "consequences": [
                    "Time spent exploring",
                    "Alternate paths may have their own hazards",
                    "May not be accessible for all party members"
                ],
                "flavorText": {
                    "attempt": "You scan the area for alternative entry points.",
                    "success": "You spot a ventilation shaft / window / structural weakness that bypasses the door entirely.",
                    "failure": "No viable alternate routes present themselves."
                },
                "uiHints": {
                    "colorHint": "cyan",
                    "iconHint": "eye"
                }
            }
        ],
        "SecuredTerminal": [
            {
                "methodId": "alt_terminal_find_codes",
                "methodName": "Find Codes",
                "description": "Search for written passwords or credentials in the area.",
                "requiredCheck": "Investigation",
                "checkDc": 16,
                "timeRequired": "5-15 minutes",
                "prerequisites": [],
                "consequences": [
                    "Time spent searching",
                    "Codes may be expired or single-use",
                    "May find partial codes only"
                ],
                "flavorText": {
                    "attempt": "You search nearby desks, notes, and hidden compartments for written credentials.",
                    "success": "Success! Someone left their password on a sticky note. Typical.",
                    "failure": "No written credentials can be found nearby."
                },
                "uiHints": {
                    "colorHint": "green",
                    "iconHint": "document"
                }
            },
            {
                "methodId": "alt_terminal_hotwire",
                "methodName": "Hotwire to Different Terminal",
                "description": "Bypass this terminal by connecting to a less secured access point.",
                "requiredCheck": "Wits",
                "checkDc": 14,
                "timeRequired": "2-5 rounds",
                "prerequisites": [
                    "Secondary terminal must exist in area",
                    "Wire or cable available"
                ],
                "consequences": [
                    "Reduced access level (User instead of Admin)",
                    "Connection may be unstable",
                    "May trigger ICE on secondary terminal"
                ],
                "accessLevelGranted": "User",
                "flavorText": {
                    "attempt": "You locate a secondary terminal and begin splicing a connection.",
                    "success": "The bypass connection establishes—you have limited but functional access.",
                    "failure": "The connection fails to establish. The terminals are incompatible."
                },
                "uiHints": {
                    "colorHint": "yellow",
                    "iconHint": "cable"
                }
            },
            {
                "methodId": "alt_terminal_partial",
                "methodName": "Accept Partial Access",
                "description": "Stop at User Level access rather than pursuing Admin Level.",
                "requiredCheck": "None",
                "checkDc": 0,
                "timeRequired": "Immediate",
                "prerequisites": [
                    "Must have achieved at least User Level access"
                ],
                "consequences": [
                    "Cannot access hidden or classified files",
                    "Limited functionality available",
                    "May need to return later with better access"
                ],
                "accessLevelGranted": "User",
                "flavorText": {
                    "attempt": "You decide that User Level access is sufficient for your current needs.",
                    "success": "You proceed with the limited access available to you.",
                    "failure": null
                },
                "uiHints": {
                    "colorHint": "gray",
                    "iconHint": "lock-partial"
                }
            }
        ],
        "ActiveTrap": [
            {
                "methodId": "alt_trap_trigger_distance",
                "methodName": "Trigger from Distance",
                "description": "Throw an object or use ranged attack to safely trigger the trap.",
                "requiredCheck": "Finesse",
                "checkDc": 12,
                "timeRequired": "1 round",
                "prerequisites": [
                    "Object to throw or ranged weapon",
                    "Line of sight to trigger mechanism"
                ],
                "consequences": [
                    "Noise from trap activation",
                    "Trap effects apply to area (may destroy loot)",
                    "Consumes thrown object"
                ],
                "flavorText": {
                    "attempt": "You ready a thrown object, aiming for the trap's trigger mechanism.",
                    "success": "Your throw is true—the trap activates harmlessly at a safe distance.",
                    "failure": "Your throw misses the trigger. The trap remains armed."
                },
                "uiHints": {
                    "colorHint": "orange",
                    "iconHint": "throw"
                }
            },
            {
                "methodId": "alt_trap_destroy",
                "methodName": "Destroy Mechanism",
                "description": "Attack the trap mechanism directly to disable it.",
                "requiredCheck": "Attack",
                "checkDc": 0,